{
 "$schema": "../../../../schemas/content-questions.schema.json",
 "schemaVersion": 1,
 "note": "Statements are paraphrased in our own words; the source's wording and scale are linked from each question.",
 "cats": {
  "law": {
   "t": "מערכת המשפט ויחסי הרשויות",
   "a": "נבחרי הציבור צריכים להכריע במחלוקות ערכיות, ושופטים נבחרים היום בשיטה שבה לציבור אין השפעה ישירה.",
   "b": "בישראל אין חוקה כתובה ואין בית מחוקקים שני, ולכן בית המשפט הוא אחד הבלמים המעטים על כוחו של הרוב."
  },
  "draft": {
   "t": "גיוס ושוויון בנטל",
   "a": "הצבא צריך כוח אדם, ומשרתי הסדיר והמילואים נושאים עומס כבד. בלי אכיפה, חובת השירות נשארת על הנייר.",
   "b": "לימוד תורה הוא ערך מרכזי בציבור החרדי, ורבים בחברה הערבית חוששים מחובת שירות. יש מי שמעדיפים הסדר מדורג או מוסכם."
  },
  "religion": {
   "t": "דת ומדינה",
   "a": "מי שלא יכול או לא רוצה להינשא דרך הרבנות צריך חלופה, ותחבורה בשבת חשובה במיוחד למי שאין לו רכב.",
   "b": "הסטטוס קוו שומר על אופי יהודי משותף במרחב הציבורי, ושינוי בו עלול להעמיק את הפילוג."
  },
  "security": {
   "t": "ביטחון, שטחים והסדר מדיני",
   "a": "שליטה ממושכת באוכלוסייה פלסטינית מסכנת את הרוב היהודי ואת מעמדה הבינלאומי של ישראל.",
   "b": "נסיגה או מדינה פלסטינית עלולות ליצור איום ביטחוני. תומכי הגישה מזכירים את מה שקרה בעזה אחרי ההתנתקות."
  },
  "war": {
   "t": "הלחימה בעזה ובלבנון",
   "a": "בלי פירוק מלא של הנשק האיום יחזור, והסכמים בלי אכיפה כבר נכשלו בעבר.",
   "b": "המשך הלחימה גובה מחיר בחיילים, בכלכלה וביחסים עם ארה\"ב, והסדר עם ערבויות בינלאומיות עשוי להשיג יותר."
  },
  "account": {
   "t": "אחריותיות וחקירת 7 באוקטובר",
   "a": "רק ועדה עצמאית עם סמכויות מלאות תוכל לחקור גם את הדרג המדיני ולזכות באמון רחב.",
   "b": "חלק מהציבור רואה בוועדה שנשיא בית המשפט העליון ממנה גוף מוטה, ומעדיף מנגנון מינוי בהסכמה רחבה."
  },
  "edu": {
   "t": "חינוך",
   "a": "לימודי ליבה נותנים לכל ילד כלים לשוק העבודה, והמדינה רשאית להתנות בהם את המימון שלה.",
   "b": "קהילות דתיות מבקשות לקבוע בעצמן את תוכנית הלימודים, והתניה כספית פוגעת קודם כול בילדים."
  },
  "coalition": {
   "t": "עם מי הם ישבו",
   "a": "השאלות האלה עוסקות בשותפים שהמפלגה מוכנה לשבת איתם בממשלה. לפעמים הן משפיעות על הממשלה שתקום יותר מהעמדות עצמן.",
   "b": null
  },
  "rights": {
   "t": "זכויות ושוויון",
   "a": "המדינה צריכה להבטיח שוויון בפני החוק ובמרחב הציבורי לכל האזרחים והאזרחיות.",
   "b": "יש מי שרואים בחקיקה בנושאי משפחה, מגדר והפרדה פגיעה בערכים דתיים ובחופש של קהילות לחיות לפי דרכן."
  }
 },
 "questions": [
  {
   "id": "override",
   "cat": "law",
   "title": "פסקת התגברות",
   "label": "פסקת התגברות",
   "stmt": "כשבית המשפט העליון מבטל חוק, הכנסת תוכל להשאיר אותו בתוקף אם רוב חבריה יצביעו בעדו שוב.",
   "sourceQuestionId": "q-judicial-override",
   "issue": "judicial-reform"
  },
  {
   "id": "committee",
   "cat": "law",
   "title": "רוב לנבחרים בוועדה לבחירת שופטים",
   "label": "רוב לנבחרים בוועדה לבחירת שופטים",
   "stmt": "לנבחרי הציבור צריך להיות רוב בוועדה שבוחרת את השופטים.",
   "sourceQuestionId": "q-judicial-committee",
   "issue": "judicial-reform"
  },
  {
   "id": "sanctions",
   "cat": "draft",
   "title": "סנקציות על מי שלא מתגייס",
   "label": "סנקציות על מי שלא מתגייס",
   "stmt": "מי שלא מתייצב לגיוס בלי פטור לפי החוק צריך לשאת בסנקציות, למשל אישיות או כלכליות.",
   "sourceQuestionId": "q-draft-sanctions",
   "issue": "haredi-draft"
  },
  {
   "id": "civil_service",
   "cat": "draft",
   "title": "שירות אזרחי לצעירים ערבים",
   "label": "שירות אזרחי לצעירים ערבים",
   "stmt": "צעירים ערבים צריכים לעשות שירות אזרחי, בתנאים שייקבעו בהסכמה עם החברה הערבית.",
   "sourceQuestionId": "q-arab-civil-service",
   "issue": "haredi-draft"
  },
  {
   "id": "shabbat",
   "cat": "religion",
   "title": "תחבורה ציבורית בשבת",
   "label": "תחבורה ציבורית בשבת",
   "stmt": "רשויות מקומיות שרוצות בכך צריכות לקבל אפשרות להפעיל תחבורה ציבורית בשבת.",
   "sourceQuestionId": "q-shabbat-transport",
   "issue": "religion-state"
  },
  {
   "id": "civil_marriage",
   "cat": "religion",
   "title": "נישואין אזרחיים",
   "label": "נישואים אזרחיים",
   "stmt": "צריך לאפשר נישואים אזרחיים בישראל.",
   "sourceQuestionId": "q-civil-marriage",
   "issue": "religion-state"
  },
  {
   "id": "grandchild",
   "cat": "religion",
   "title": "ביטול סעיף הנכד",
   "label": "ביטול סעיף הנכד",
   "stmt": "צריך לבטל את \"סעיף הנכד\" בחוק השבות, כך שנכד של יהודי שאינו יהודי בעצמו לא יוכל לעלות מכוחו.",
   "sourceQuestionId": "q-grandchild-clause",
   "issue": "religion-state"
  },
  {
   "id": "pal_state",
   "cat": "security",
   "title": "הסדר קבע עם מדינה פלסטינית",
   "label": "הסדר קבע עם מדינה פלסטינית",
   "stmt": "ישראל צריכה לחתור להסדר קבע שבסופו תקום מדינה פלסטינית.",
   "sourceQuestionId": "q-two-states",
   "issue": "territories"
  },
  {
   "id": "sovereignty",
   "cat": "security",
   "title": "ריבונות ביהודה ושומרון",
   "label": "ריבונות ביהודה ושומרון",
   "stmt": "בקדנציה הבאה ישראל צריכה להחיל ריבונות על חלקים מיהודה ושומרון.",
   "sourceQuestionId": "q-sovereignty",
   "issue": "territories"
  },
  {
   "id": "gaza_settle",
   "cat": "security",
   "title": "התיישבות ברצועת עזה",
   "label": "התיישבות ברצועת עזה",
   "stmt": "צריך לחדש את ההתיישבות היהודית ברצועת עזה.",
   "sourceQuestionId": "q-gaza-settlement",
   "issue": "territories"
  },
  {
   "id": "gaza_war",
   "cat": "war",
   "title": "חידוש הלחימה בעזה",
   "label": "חידוש הלחימה בעזה",
   "stmt": "אם חמאס לא יתפרק מנשקו, ישראל צריכה לחזור ללחימה ברצועה, גם בניגוד לעמדת ארצות הברית ומועצת השלום.",
   "sourceQuestionId": "q-gaza-resume-war",
   "issue": "war-fronts"
  },
  {
   "id": "lebanon",
   "cat": "war",
   "title": "רצועת הביטחון בלבנון",
   "label": "רצועת הביטחון בלבנון",
   "stmt": "צה\"ל צריך להישאר ברצועת הביטחון בדרום לבנון עד שחיזבאללה יפורק מנשקו, גם אם זה ימנע הסכם עם ממשלת לבנון.",
   "sourceQuestionId": "q-lebanon-security-zone",
   "issue": "war-fronts"
  },
  {
   "id": "inquiry",
   "cat": "account",
   "title": "ועדת חקירה ממלכתית ל-7 באוקטובר",
   "label": "ועדת חקירה ממלכתית",
   "stmt": "צריך להקים ועדת חקירה ממלכתית לאירועי 7 באוקטובר.",
   "sourceQuestionId": "q-state-inquiry-v2",
   "issue": "oct7-inquiry"
  },
  {
   "id": "core",
   "cat": "edu",
   "title": "תקצוב מותנה בלימודי ליבה",
   "label": "תקצוב מותנה בלימודי ליבה",
   "stmt": "מוסד חינוך יקבל תקציב מהמדינה רק אם ילמד ליבה מלאה: מתמטיקה, אנגלית ומדעים.",
   "sourceQuestionId": "q-core-curriculum",
   "issue": null
  },
  {
   "id": "no_bibi",
   "cat": "coalition",
   "title": "לסרב לממשלה בראשות נתניהו",
   "label": "סירוב לממשלה בראשות נתניהו",
   "stmt": "הרשימה שאצביע לה צריכה לסרב להצטרף לממשלה שבראשה בנימין נתניהו.",
   "sourceQuestionId": "q-netanyahu-government",
   "issue": null
  },
  {
   "id": "raam_join",
   "cat": "coalition",
   "title": "לצרף את רע\"ם במקום בחירות",
   "label": "צירוף רע\"ם במקום בחירות",
   "stmt": "אם אין דרך אחרת להקים ממשלה, עדיף לצרף את רע\"ם לקואליציה מאשר ללכת לבחירות חוזרות.",
   "sourceQuestionId": "q-raam-coalition",
   "issue": null
  },
  {
   "id": "arab_support",
   "cat": "coalition",
   "title": "תמיכה מבחוץ של מפלגות ערביות",
   "label": "תמיכה מבחוץ של מפלגות ערביות",
   "stmt": "ממשלה יכולה להסתמך על תמיכה של מפלגות ערביות מחוץ לקואליציה.",
   "sourceQuestionId": "q-arab-parties-outside-support",
   "issue": null
  },
  {
   "id": "no_haredim",
   "cat": "coalition",
   "title": "לסרב לשבת עם ש\"ס ויהדות התורה",
   "label": "סירוב לשבת עם ש\"ס ויהדות התורה",
   "stmt": "הרשימה שאצביע לה צריכה לסרב לשבת בממשלה עם ש\"ס ויהדות התורה.",
   "sourceQuestionId": "q-haredi-parties-coalition",
   "issue": null
  },
  {
   "id": "lgbt",
   "cat": "rights",
   "title": "שוויון זכויות ללהט\"ב",
   "label": "שוויון זכויות ללהט\"ב",
   "stmt": "זוגות חד-מיניים ואנשים להט\"בים צריכים לקבל מהמדינה אותן זכויות ואותו מעמד משפטי כמו כל אזרח.",
   "sourceQuestionId": "q-lgbt-equality",
   "issue": "lgbt-rights"
  },
  {
   "id": "women_rep",
   "cat": "rights",
   "title": "ייצוג נשים בחוק",
   "label": "ייצוג נשים בחוק",
   "stmt": "החוק צריך לחייב ייצוג הולם לנשים ברשימות לכנסת וברשויות המקומיות.",
   "sourceQuestionId": "q-womens-representation",
   "issue": "womens-rights"
  },
  {
   "id": "segregation",
   "cat": "rights",
   "title": "איסור הפרדה מגדרית במימון המדינה",
   "label": "איסור הפרדה מגדרית",
   "stmt": "אסור שתהיה הפרדה בין נשים לגברים בלימודים, באירועים ובשירותים במימון המדינה, גם כשהיא מוצגת כרצונית.",
   "sourceQuestionId": "q-gender-segregation",
   "issue": "womens-rights"
  }
 ],
 "short": [
  "committee",
  "sanctions",
  "shabbat",
  "pal_state",
  "sovereignty",
  "gaza_war",
  "inquiry",
  "core",
  "no_bibi",
  "lgbt"
 ]
}
